{"apiVersion":"a1os/v1","kind":"Capability","metadata":{"id":"messaging.kafka","name":"Kafka","version":"1.0.0"},"spec":{"category":"messaging","description":"Durable event streaming, topic, consumer group and replication capability using modern KRaft architecture.","operations":["discover","provision","configure","secure","topic_create","topic_update","produce","consume","lag","replicate","backup","restore","scale","upgrade","decommission"],"dependencies":["networking","storage","secrets","observability"],"providers":["local","docker","kubernetes","aws","gcp"],"verification":{"required":["broker","controller","topic","consumer_lag","monitoring"]},"recovery":{"supported":true}}}