{"apiVersion":"a1os/v1","kind":"Capability","metadata":{"id":"infrastructure.docker","name":"Docker","version":"1.0.0"},"spec":{"category":"infrastructure","description":"Container build, image, runtime, network and lifecycle capability.","operations":["discover","build","pull","run","stop","restart","inspect","network","volume","prune","upgrade","decommission"],"dependencies":["networking","storage","secrets","observability"],"providers":["local","linux"],"verification":{"required":["daemon","container","image","network","health"]},"recovery":{"supported":true}}}