{"apiVersion":"a1os/v1","kind":"Capability","metadata":{"id":"infrastructure.terraform","name":"Terraform","version":"1.0.0"},"spec":{"category":"infrastructure","description":"Infrastructure-as-code planning, provisioning, change and state lifecycle capability.","operations":["discover","init","validate","plan","apply","destroy","state","import","drift","upgrade","lock"],"dependencies":["secrets","state","cloud"],"providers":["local","aws","gcp","kubernetes"],"verification":{"required":["syntax","plan","state","drift"]},"recovery":{"supported":true}}}