{"apiVersion":"a1os/v1","kind":"Capability","metadata":{"id":"security.secrets","name":"Secrets","version":"1.0.0"},"spec":{"category":"security","description":"Secret storage, retrieval, rotation, policy and audit capability.","operations":["discover","provision","store","retrieve","rotate","revoke","audit","restore","decommission"],"dependencies":["identity","authorization","audit"],"providers":["environment","filesystem","vault","cloud"],"verification":{"required":["access_policy","encryption","rotation","audit"]},"recovery":{"supported":true}}}