{"apiVersion":"a1os/v1","kind":"Capability","metadata":{"id":"infrastructure.ansible","name":"Ansible","version":"1.0.0"},"spec":{"category":"infrastructure","description":"Configuration management, provisioning, hardening and orchestration capability.","operations":["discover","lint","check","configure","harden","deploy","rollback","upgrade","decommission"],"dependencies":["networking","secrets","observability"],"providers":["linux","docker","kubernetes","aws","gcp"],"verification":{"required":["syntax","idempotency","configuration","health"]},"recovery":{"supported":true}}}