{"apiVersion":"a1os/v1","kind":"Capability","metadata":{"id":"infrastructure.kubernetes","name":"Kubernetes","version":"1.0.0"},"spec":{"category":"infrastructure","description":"Cluster, workload, service, policy, rollout and recovery capability.","operations":["discover","provision","configure","deploy","rollout","rollback","scale","network","secret","policy","health","upgrade","decommission"],"dependencies":["networking","storage","secrets","observability"],"providers":["local","aws","gcp","kubernetes"],"verification":{"required":["cluster","nodes","workload","service","policy","monitoring"]},"recovery":{"supported":true}}}