{"apiVersion":"a1os/v1","kind":"Capability","metadata":{"id":"observability.core","name":"Observability","version":"1.0.0"},"spec":{"category":"observability","description":"Metrics, logs, traces, health, alerting and SLO evidence capability.","operations":["discover","instrument","collect","query","alert","dashboard","health","slo","diagnose","retain"],"dependencies":["networking","storage"],"providers":["prometheus","grafana","opentelemetry","local"],"verification":{"required":["metrics","logs","health","alerts"]},"recovery":{"supported":false}}}