{"apiVersion":"a1os/v1","kind":"Capability","metadata":{"id":"cache.redis","name":"Redis","version":"1.0.0"},"spec":{"category":"caching","description":"Redis cache, state and high-availability capability.","operations":["discover","provision","configure","secure","sentinel","cluster","backup","restore","failover","scale","diagnose","upgrade","decommission"],"dependencies":["networking","storage","secrets","observability"],"providers":["local","docker","kubernetes","aws","gcp"],"verification":{"required":["health","connectivity","persistence","replication","monitoring"]},"recovery":{"supported":true}}}