{"apiVersion":"a1os/v1","kind":"Capability","metadata":{"id":"networking.nginx","name":"NGINX","version":"1.0.0"},"spec":{"category":"networking","description":"Reverse proxy, load balancing, TLS, rate limiting and edge caching capability.","operations":["discover","provision","configure","secure","route","load_balance","rate_limit","cache","health","upgrade","rollback","decommission"],"dependencies":["networking","secrets","observability"],"providers":["local","docker","kubernetes"],"verification":{"required":["configuration","tls","upstream","health","observability"]},"recovery":{"supported":true}}}