{"apiVersion":"a1os/v1","kind":"Capability","metadata":{"id":"database.postgresql","name":"PostgreSQL","version":"1.0.0"},"spec":{"category":"database","description":"Relational database capability with lifecycle, replication, backup and recovery operations.","operations":["discover","provision","configure","secure","backup","restore","replicate","failover","diagnose","upgrade","migrate","scale","decommission"],"dependencies":["networking","storage","secrets","observability"],"providers":["local","docker","kubernetes","aws","gcp"],"verification":{"required":["health","connectivity","configuration","backup","monitoring"]},"recovery":{"supported":true}}}